[
  {
    "id": "account-github",
    "account_id": "account-github",
    "title": "GitHub 主账号",
    "account_type": "developer_platform",
    "platform": "GitHub",
    "space_id": "space-personal-zero",
    "owner_subject_id": "subject-hay2045",
    "status": "active",
    "health_status": "healthy",
    "channel_role": "governance",
    "endpoint_id": "endpoint-local-workstation",
    "source_ref": "generated://account/github",
    "confidence": 0.95,
    "updated_at": "2026-03-14T21:48:39+08:00"
  },
  {
    "id": "account-feishu",
    "account_id": "account-feishu",
    "title": "Feishu 主账号",
    "account_type": "collaboration",
    "platform": "Feishu",
    "space_id": "space-personal-zero",
    "owner_subject_id": "subject-hay2045",
    "status": "active",
    "health_status": "healthy",
    "channel_role": "governance",
    "endpoint_id": "endpoint-feishu-mobile",
    "source_ref": "generated://account/feishu",
    "confidence": 0.94,
    "updated_at": "2026-03-14T21:48:39+08:00"
  },
  {
    "id": "account-wechat",
    "account_id": "account-wechat",
    "title": "微信主号",
    "account_type": "social",
    "platform": "WeChat",
    "space_id": "space-personal-zero",
    "owner_subject_id": "subject-hay2045",
    "status": "planned",
    "health_status": "needs_inventory",
    "channel_role": "private",
    "endpoint_id": "endpoint-feishu-mobile",
    "source_ref": "generated://account/wechat",
    "confidence": 0.86,
    "updated_at": "2026-03-14T21:48:39+08:00"
  },
  {
    "id": "account-video-channel",
    "account_id": "account-video-channel",
    "title": "视频号阵地",
    "account_type": "content_channel",
    "platform": "Video Channel",
    "space_id": "space-personal-zero",
    "owner_subject_id": "subject-hay2045",
    "status": "planned",
    "health_status": "needs_inventory",
    "channel_role": "public",
    "endpoint_id": "endpoint-feishu-mobile",
    "source_ref": "generated://account/video-channel",
    "confidence": 0.84,
    "updated_at": "2026-03-14T21:48:39+08:00"
  },
  {
    "id": "account-bilibili",
    "account_id": "account-bilibili",
    "title": "B站阵地",
    "account_type": "content_channel",
    "platform": "Bilibili",
    "space_id": "space-personal-zero",
    "owner_subject_id": "subject-hay2045",
    "status": "planned",
    "health_status": "needs_inventory",
    "channel_role": "public",
    "endpoint_id": "endpoint-terminal-a",
    "source_ref": "generated://account/bilibili",
    "confidence": 0.84,
    "updated_at": "2026-03-14T21:48:39+08:00"
  },
  {
    "id": "account-douyin",
    "account_id": "account-douyin",
    "title": "抖音阵地",
    "account_type": "content_channel",
    "platform": "Douyin",
    "space_id": "space-personal-zero",
    "owner_subject_id": "subject-hay2045",
    "status": "planned",
    "health_status": "needs_inventory",
    "channel_role": "public",
    "endpoint_id": "endpoint-terminal-b",
    "source_ref": "generated://account/douyin",
    "confidence": 0.84,
    "updated_at": "2026-03-14T21:48:39+08:00"
  },
  {
    "id": "account-xiaohongshu",
    "account_id": "account-xiaohongshu",
    "title": "小红书阵地",
    "account_type": "content_channel",
    "platform": "Xiaohongshu",
    "space_id": "space-personal-zero",
    "owner_subject_id": "subject-hay2045",
    "status": "planned",
    "health_status": "needs_inventory",
    "channel_role": "public",
    "endpoint_id": "endpoint-terminal-c",
    "source_ref": "generated://account/xiaohongshu",
    "confidence": 0.84,
    "updated_at": "2026-03-14T21:48:39+08:00"
  }
]
